,title,price,score,sold,store
3542,"Планшет с 10,1-дюймовым дисплеем, ОЗУ 6 ГБ, ПЗУ 11,6 ГБ, Android 128","12 610,80",,,CN GO GO Jiuliuyar Store
3543,"Планшет Xiaomi MI PAD 4 Plus, экран 10,1 дюйма, 4 Гб ОЗУ, 64 Гб ПЗУ, планшет Android LTE, Snapdragon 660, 1920x1200, HD планшет на Android","18 096,50",,1,ChiinaSONY Authentication Store
3544,"Планшет с 10,1-дюймовым дисплеем, ОЗУ 12 Гб, ПЗУ 10,1 ГБ, Android 11","10 999,42",,,LSKDZ Tablet Online Store
3545,"Планшет Pro 11 дюймов, 12 Гб ОЗУ 512 Гб ПЗУ, Android 10,0, GPS, Bluetooth, Google Play","10 018,58",,,jaysong tablets global Store
3546,"Новейшая модель; Женские ботинки версия 10 дюймовый планшет MT6762 Octa Core 1920*1200 2,5 K IPS Экран Dual Core 4G, 3 Гб оперативной памяти, Оперативная память 64 Г...","10 818,67",,,RainBoo Store
3547,"Оригинальный планшет Xiaomi Mi 5, Snapdragon 860, 11 дюймов, 2,5 K, ЖК-дисплей, 120 Гц, 6 ГБ + 128 Гб/256 Гб ПЗУ, двойная камера, 8720 мАч, Wi-Fi, Android 11","40 843,58","5,0",16,OLOEY PROJECTOR GLOBAL Store
3548,"Новый планшетный ПК 10 дюймов 8 ГБ ОЗУ 128 Гб ПЗУ 1920*1200 IPS экран Google Play 4G LTE телефонные звонки GPS WiFi TYPE-C Android 10,0 планшеты","11 500,35",,,BEESITTO Official Store
3549,"10,6 Inch Tablet PC 1920x1280 Pcs10 деко Core 6 ГБ Оперативная память 128 Гб Встроенная память 4 аппарат не привязан к оператору сотовой связи Телефонный звонок ...","13 039,57",,,OneTablet Store
3550,"Планшет с 10-дюймовым дисплеем, десятиядерным процессором MTK6797, ОЗУ 6 ГБ, ПЗУ 10,0 ГБ, 1920x1200","13 921,62",,,OneTablet Store
3551,"X16 Plus планшет на Android 10,6, четыре ядра, экран 5,1 дюйма, 2 Гб + 32 ГБ","6 096,62","5,0",3,Tablet inventory Store
3552,"Новинка 2022, планшет Android, 10,1 дюймов, 8 ГБ + 128 Гб, планшет Full Netcom, игровой тонкий офис «Два в одном», онлайн-класс","8 479,36",,,Shop1100048106 Store
3553,"Новый детский планшет 7 дюймов планшет Android 6,0 Google Play 2 ГБ/16 Гб SIM-карта + WiFi Bluetooth дешевый и простой любимый подарок для детей","4 337,41",,,BDF BDF Tablet Global Store Store
3554,"2022 новый планшетный ПК X30L 10,1 дюймов, десятиядерный MT6797, 6 ГБ ОЗУ 128 Гб ПЗУ, 4G LTE, Android 10,0, 1920X1200, 2,5 K IPS планшет","10 401,11",,,Yusunoul Store
3555,"Новый планшет 10,1 дюймов 8 ГБ ОЗУ 128 Гб ПЗУ планшет Android 10,0 двойной Telefoontje 5G с 5000 мАч GPS Bluetooth WiFi планшетный ПК","6 200,31",,,well tablet Store
3556,"Планшет с искусственным интеллектом, 1920x1200, 8-ядерный процессор, Android 10,1, экран 10,0 дюйма","20 316,70",,,VelocMate Technologies Store
3557,"10-дюймовый планшет Google, Android 11,0, ОС, Восьмиядерный процессор, 6 ГБ ОЗУ, 128 Гб ПЗУ, 1280x800 IPS, 4G, LTE, GPS, Wi-Fi, Bluetooth, ет 10","11 206,10",,,perkbox Official Store
3558,"Планшет с 10,1-дюймовым дисплеем, восьмиядерным процессором, ОЗУ 8 Гб, ПЗУ 10,1 ГБ, 2-мя слотами для SIM-карт, камерой 5 МП, Wi-Fi, Bluetooth, GPS","6 126,75",,,well tablet Store
3559,"Blackview Tab 10 планшет на Android 11, восемь ядер, экран 10,1 дюйма, 4 Гб + 64 ГБ","12 241,58","5,0",2,eForChina Store Store
3560,Планшет Digma Citi Kids 81 Blue,"7 482,00",,,Фирменный магазин Pleer.ru
3561,"Ультратонкий планшет с 10-дюймовым дисплеем, восьмиядерным процессором, ОЗУ 2 Гб, ПЗУ 32 ГБ, 5,0 Мбит/с, 9,0 дюйма, Android 10,1, Wi-Fi","11 729,45",,,honyuda Store
3562,"Планшет Lenovo Xiaoxin Pad Pro, Восьмиядерный процессор Snapdragon 730, 6 ГБ ОЗУ, 128 Гб ПЗУ, экран 11,5 дюйма 2560*1600, Wi-Fi, 8500 мАч","27 322,70","5,0",1,E-live Store
3563,"Teclast M40 Pro 10,1-дюймовый планшет с восьмиядерным процессором, ОЗУ 6 ГБ, ПЗУ 10,1 ГБ, 128x7000, Android 11","14 439,37","3,0",,Super Max Store
3564,"Три анти-промышленный планшетный компьютер с отпечатков пальцев NFC 10,1 дюймов Android 7,0 4 ядра 4 аппарат не привязан к оператору сотовой связи 2G О...","27 883,88",,,BMXC Factory Store
3565,"Планшет Ulefone Tab A7, 4G, 10,1 дюйма, 4 + 64 ГБ, 7680 мАч, Android 11,0, 8 ядер, 1,6 ГГц","14 011,30","5,0",,Creativehome
3566,"Планшет с 10-дюймовым дисплеем, десятиядерным процессором MT6797, ОЗУ 6 ГБ, ПЗУ 2022 ГБ, 4G LTE","19 767,43",,,Tablet Factory Store
3567,"BDF планшет с 10,1-дюймовым дисплеем, четырёхъядерным процессором, ОЗУ 2 Гб, ПЗУ 32 ГБ, Android 10,1","6 582,84",,,ShenZhen BDF Tablet Technology Co. Store
3568,"Планшеты Pipo X4, 10,1 дюйма, 1920*1200, с тремя степенями защиты, Win10 Pro Intel Pentium N4205 6G 128G, одномерный сканер кода, QR-кода","33 163,60",,4,Pipo Official Store Official Store
3569,Планшет Hegitech Tab7 2 ГБ 32 ГБ 7 дюймов 1024x600,"8 407,20",,,MUSMEL Store
3570,"Женский 10,1-дюймовый K50 планшет 8 Восьмиядерный 4 Гб ОЗУ 64 Гб ПЗУ планшет Android 10,1 планшет 4G WIFI 10,0 мАч GPS планшет","12 405,52",,,lenmon tablets Store
3571,"10,1-дюймовый планшет 2 в 1 с клавиатурой для офиса и игр, MT6797, 10-ядерный, камера 13 МП, 4G, сетевой телефон, двойной Wi-Fi","18 439,09",,,Nenmone Official Store
3572,"Планшет на Android, экран 10 дюймов, 6 ГБ + 128 Гб, камера 13 МП + 5 МП","13 031,16",,,Tablet Factory Store
3573,"Новейшая модель; 10,1 дюймов планшет MT6797 X25 Deca Core, размер экрана 1920*1200 2,5 K IPS Экран Dual Core 4G 6 ГБ Оперативная память 128 Гб Встроенная память планшет...","20 175,88",,,honyuda Store
3574,"10,1-дюймовый планшет с восьмиядерным процессором, ОЗУ 6 ГБ, ПЗУ 64 ГБ","9 574,40",,,LSKDZ Tablet PC Store
3575,"Новинка 10,1 дюймовый 2022 Android 10,0 планшет 6 ГБ ОЗУ + 128 Гб ПЗУ 5000 мАч аккумулятор игровой планшетный компьютер 4G телефон планшетный ПК","6 095,22",,,100% tablet Store
3576,"Планшет BDF на Android 10,1, четыре ядра, экран 9,0 дюйма, 2 Гб + 32 ГБ","6 554,11",,,BDF BDF Tablet Global Store Store
3577,"Планшет Digma Optima 1028 3G Black 10.1"" IPS Spreadtrum SC7731E 2Гб 8Гб 8Mп Android 4000mAh","7 245,00",,,Интернет Гипермаркет Pleer.Ru
3578,"Планшет на Android 10,1, экран 10,0 дюйма, 4 Гб + 64 ГБ","8 165,49",,,CN GO GO Jiuliuyar Store
3579,"Детский планшет с 7-дюймовым дисплеем, четырёхъядерным процессором, ОЗУ 2 Гб, ПЗУ 16 Гб, Android 7,0","3 222,76",,,BDF BDF Tablet Global Store Store
3580,"10-дюймовый планшет с четырёхъядерным процессором, ОЗУ 32 ГБ, ПЗУ 1280x800, Android 9,0","12 750,92",,,"Shenzhen HongyangTechnology Co., Ltd."
3581,"Samsung Galaxy Tab A8 телефон, 3 ГБ 32 ГБ, экран 10,5 дюймов","17 157,69",,,Koc market Store
3582,"10-дюймовый планшет ZONKO Android 9,0 Pie, планшетный ПК с восьмиядерным процессором SC9863A, 1920*1200, 2 Гб ОЗУ, 32 Гб ПЗУ, 5G, WiFi, GPS, Bluetooth, планшеты","14 618,02",,,ZONAEP Store
3583,"Full HD Android 9,0 4G, с функцией звонка 6 ГБ Оперативная память 32/64GB Встроенная память 5G WI-FI 1920*1200 IPS Deca Core, размер экрана планшетный ПК 10 дюймов Google Play ...","9 997,56",,,Yusunoul Store
3584,"Новый оригинальный планшетный ПК 10,1 дюймов Android 9,0 Google Play 3G телефонные звонки планшеты Wi-Fi Bluetooth GPS 10 дюймов закаленное стекло","5 762,44","5,0",5,SHENZHEN BDF Tablet Store
3585,"IPS 1920*1280 Android 8,0 10,6 дюймов студент планшетный ПК 10 деко Core 6 ГБ Оперативная память 128 Гб Встроенная память 4 аппарат не привязан к оператору сото...","12 977,91",,,Professional Laptop Tablet Store
3586,"Планшет 10 дюймов, Android 2022, Восьмиядерный процессор, 6 ГБ ОЗУ, 64 Гб ПЗУ, 4G, FDD, LTE, Wi-Fi, Bluetooth, GPS, аккумулятор 10,0 мАч, Тип C, 5000","18 914,80",,,BEESITTO Official Store
3587,"HUAWEI MatePad 11 планшет с 5,5-дюймовым дисплеем, восьмиядерным процессором Snapdragon 10,95, ОЗУ 6 ГБ, ПЗУ 120 ГБ, 128 мАч","34 073,68",,3,Shenzhen Pophong Store
3588,"Планшет, 10 дюймов, Android 2020, Восьмиядерный процессор, 6 ГБ + 64 Гб ПЗУ, 4G, FDD, LTE, две SIM-карты, экран 2.5D, Wi-Fi, Bluetooth, GPS, новинка 9,0","9 574,40",,,LSKDZ Tablet PC Store
3589,"ALLDOCUBE iPlay 40 Pro  Планшетный ПК 10,4 дюйма 2K Android 11 8 Гб RAM 256 ГБ ROM Octa Core Unisoc®Планшет Tiger T618 4G Lte 2000*1200 IPS","16 813,70","5,0",2,ALLDOCUBE Global Official Store
3590,"Хит продаж, ультратонкий новейший планшетный ПК X30L 10,1 дюйма, десятиядерный MT6797, 6 ГБ ОЗУ, 128 Гб ПЗУ, 4G LTE, Android 10,0, 1920X1200, 2,5 K IPS-планшет","10 188,83",,,Yusunoul Store
3591,"Глобальная версия планшет android 10 дюймов планшетный ПК 12 Гб RAM + 512 ГБ ROM 10 дюймов графический планшет две sim-карты игровой ноутбук Android 11,0","11 222,91",,,LSKDZ Tablet Online Store
3592,"10-дюймовый планшет ZONKO, Android 9,0, 4G LTE, телефонные звонки, планшетный ПК, восьмиядерные планшеты 1920x1200 FHD, 2 Гб ОЗУ, 32 Гб ПЗУ, GPS, быстрая зарядка","11 408,57",,,ZONAEP Store
3593,"Планшет с 10,1-дюймовым дисплеем, десятиядерным процессором, ОЗУ 6 ГБ, ПЗУ 2022 ГБ, Android 10,1, 2-мя слотами для SIM-карт","6 088,21",,,Gifts Tablet Pc Store
3594,"Планшет с 10,1-дюймовым дисплеем, восьмиядерным процессором, ОЗУ 4 Гб, 3g 4g LTE, 2-мя слотами для SIM-карт","9 626,24",,,Shop4052048 Store
3595,"Планшет 10 дюймов, 10,1 дюйма, IPS, 10 ядер, 2 SIM-карты, 4G, 6 ГБ ОЗУ, 128 Гб ПЗУ, 5G дюйма, Wi-Fi, Bluetooth","10 141,18",,,Beesitto Online Store
3596,"Планшетный ПК 10 дюймов, 4G LTE + Wi-Fi, Android 9,0, Восьмиядерный, 2 Гб 32 Гб ПЗУ, FM-радио, Bluetooth, SIM-карта, мобильный телефон, сообщения о вызовах","6 854,67",,,BDF Official Store
3597,"10-дюймовый планшет с восьмиядерным процессором, ОЗУ 8 Гб, ПЗУ 128 ГБ, камерой 13 МП + 5 МП, 1920x1200","11 500,35",,,BEESITTO Official Store
3598,"Планшет ZONKO на Android 10,1, 10,1-дюймовый планшетный ПК, Восьмиядерный, 2 Гб ОЗУ 32 Гб ПЗУ, планшеты 1920*1200 IPS Google Play с двойной камерой и GPS","11 787,60",,,ZONAEP Store
3599,"Планшет Google Play на Android 10,1, восемь ядер, экран 10,0 дюйма, 4 Гб + 64 ГБ","8 630,69",,,ShenZhen BDF Tablet Technology Co. Store
3600,"Планшет на Android 9,0, 2022 дюйма, 8 + 10,1 ГБ, 4G","6 288,59",,,well tablet Store
3601,"Оригинальный Прочный планшетный ПК K10J с ОС Windows, промышленный компьютер, 10,1 дюйма, Intel JASPER LAKE N5105, 16 ГБ ОЗУ, RJ45, GPS, горячая Распродажа, сменный а...","119 057,16",,,KT Technology
3602,защищённый планщет Samsung Galaxy Tab Active LTE,"16 000,00",,,MrFinn Store
3603,"Планшет Perkbox на Android 11,0, восемь ядер, экран 10 дюймов, 8 ГБ + 128 ГБ","14 087,66",,1,Perkbox Global-Official Store
3604,"Blackview Tab 6 планшет, экран 8 дюймов, 3 Гб + 32 ГБ, Android 11, четырёхъядерный","7 670,87","5,0",1,eForChina Store Store
3605,"BDF планшет с 10,1-дюймовым дисплеем, восьмиядерным процессором, ОЗУ 4 Гб, ПЗУ 64 ГБ, Android 2022","6 501,57",,,ShenZhen BDF Tablet Technology Co. Store
3606,"Blackview Tab 10 Pro планшет на Android 11, восемь ядер, экран 10,1 дюйма, 8 ГБ + 128 ГБ","16 813,70","5,0",5,Creativehome
3607,"Оригинальный планшет Xiaomi Mi 5, Snapdragon 860, 11 дюймов, 2,5 K, ЖК-дисплей, 120 Гц, 6 ГБ + 128 Гб/256 Гб ПЗУ, двойная камера, 8720 мАч, Wi-Fi, Android 11","40 843,58","5,0",16,OLOEY PROJECTOR GLOBAL Store
3608,"Планшет Lenovo Xiaoxin Pad Pro, глобальная прошивка, Восьмиядерный процессор Snapdragon 730, 6 ГБ ОЗУ, 128 Гб ПЗУ, экран 11,5 дюйма 2560*1600, WiFi, 8500 мАч, Android 10","26 972,40",,,E-live Store
3609,"Планшет на Android 2022, 10 дюймов, 6 + 9,0 ГБ, 2 SIM-карты","6 088,21",,1,Gifts Tablet Pc Store
3610,"Планшет на Android 10,1, восемь ядер, экран 9,0 дюйма, 4 Гб + 64 ГБ","6 442,72",,1,SHENZHEN BDF Tablet Store
3611,"Планшет на Android 10,1, восемь ядер, экран 9,0 дюйма, 2 SIM-карты","7 626,03","5,0",,"SHENZHEN BDF TOUCH TECHNOLOGY CO.,LTD."
3612,Китай K8CT Windows 10 водонепроницаемый планшетный ПК 8 дюймов Intel Z8350 4 Гб ОЗУ 64 Гб ПЗУ двойной WiFi NFC RFID считыватель Qr-кода GPS 4G LTE Sim,"38 589,75",,,KT Technology
3613,"Планшет Pro с 10-дюймовым дисплеем, ОЗУ 12 Гб, ПЗУ 512 ГБ, Android 10,0","15 343,14",,,jaysong tablets global Store
3614,"HUAWEI MatePad планшет, экран 2022 дюймов, 6 ГБ + 10,4 ГБ","31 106,64",,1,Notebook market Store
3615,"Планшет на Android 10,1, восемь ядер, экран 9,0 дюйма, 64 ГБ + 4 Гб","6 305,40",,1,CN GO GO Jiuliuyar Store
3616,"Планшетный ПК PIPO X11, процессор Intel Celeron N4020 3 ГБ ОЗУ 64 Гб ПЗУ 9 дюймов 1920*1280 IPS win10 WiFi HDMI Bluetooth","15 412,50",,,E-live Store
3617,"Планшет Huawei MatePad T10 AGRK-L09 Deepsea Blue 9.7"" IPS Kirin 710A 2Гб 32Гб 5Mп LTE Android 5100mAh","15 809,00",,1,Интернет Гипермаркет Pleer.Ru
3618,"4G LTE планшет с 10,1-дюймовым дисплеем, четырёхъядерным процессором MTK6753, ОЗУ 2 Гб, ПЗУ 32 ГБ, Android 10,1, 7,0 мАч","7 057,84",,,Tablet inventory Store
3619,"Новейший планшетный ПК 10 дюймов Android 9,0 Google Play 4G L телефонные звонки планшеты Wi-Fi Bluetooth GPS 2.5D Закаленное стекло планшет 10 дюймов","12 359,99",,,"Shenzhen HongyangTechnology Co., Ltd."
3620,"Планшет с 10,1-дюймовым дисплеем, восьмиядерным процессором, ОЗУ 8 Гб, ПЗУ 10,0 ГБ, двумя слотами для SIM-карт, Android 10,1","6 123,24",,,100% tablet Store
3621,"Смартфон Lenovo Tab P10, экран TB-X705F дюйма, 3 Гб + 32 ГБ, Android 10,1, Восьмиядерный процессор Qualcomm Snapdragon 8,0, 450 ГГц, сканер отпечатков пальцев","12 329,86",,,aForChina Store
3622,"2022 оригинальный промышленный планшетный ПК K701 Linux, встроенный ПК с настенным креплением, 7 дюймов I.MAX 8 4 Гб ОЗУ RJ45 GPIO RS232 4xcom Can Bus","32 599,62",,,XDrone Tablet Store
3623,"Новый продукт 10-дюймовый планшет Android 9,0 Google Market 1280x800 IPS Wifi Две SIM-карты Телефонные звонки стеклянный экран 10,1 планшетный ПК + подарок","9 973,04",,,WLWY Store
3624,"Планшет с 10,1-дюймовым дисплеем, четырёхъядерным процессором, ОЗУ 2 Гб, ПЗУ 32 ГБ, Android 10,1, Wi-Fi, Bluetooth, GPS, двумя сим-картами, 3G","6 594,05",,,SHENZHEN BDF Tablet Store
3625,"10,1-дюймовый планшетный ПК 2 Гб ОЗУ 32 Гб ПЗУ Windows 10 ZTE W105 с чехлом для клавиатуры 10,1x1280 IPS Φ-совместимый нетбук","9 458,10",,1,DIGITALTOOLS Technology Ltd. 
3626,Новый планшетный ПК с системой андроида ПК обучающая машина специальный игровой 2-в-1 полный Netcom ультра-тонкий Экран двойной Камера ультра-т...,"9 738,34",,,Shop5882189 Store
3627,"Планшетный ПК Huawei M3 с глобальной прошивкой без коробки, 10,1-дюймовый экран 2K HD, телефонная связь, игровая консоль Android, планшетный ПК онлайн-кл...","12 750,92",,1,VR-World Store
3628,"Планшет на Android 10,1, 8,0 дюйма, 10-ядерный процессор MTK6797, 6 ГБ ОЗУ, 64 Гб ПЗУ, 1920 ГБ TF-карта, USB Type-C, GPS, 1200G + 128, Wi-Fi","12 577,87",,,Baby Doing Buy Store
3629,"Новое поступление 10,1 дюймовый планшетный ПК Android 9,0 Восьмиядерный Google Play 4G LTE телефонный звонок 2.5D стеклянный экран 1280*800 GPS WiFi планшет","7 282,74",,,CN GO GO Jiuliuyar Store
3630,"Планшет BQ-7036L Hornet black 4G 7 "" TN 1024*600/4х1.3 GHZ/1GB/16GB/WiFi/BT/2500mAh/And 8 Go","8 500,00",,,IT-ON Store
3631,"Blackview TAB 10 Pro планшет на Android 11, восемь ядер, экран 10,1 дюйма, 8 ГБ + 1920 ГБ","15 342,44","5,0",33,BLACKVIEW Authorized Store
3632,"Lenovo M8 смартфон с восьмиядерным процессором, ОЗУ 3 ГБ, ПЗУ 32 ГБ, 8 дюймов, 1920x1200, Android 9,0","16 813,70",,,E-live Store
3633,"10-дюймовый планшет с четырёхъядерным процессором, ОЗУ 32 ГБ, ПЗУ 32 ГБ, Android 9,0","11 909,50",,,ZONAEP Store
3634,"Подарочная док-клавиатура и стилус 2GBDDR3 + 64 Гб eMMC 10,1 дюймов Windows 10 Z3745D 3E 1366x768 IPS экран Двойная камера совместимость с HDMI","9 878,46","5,0",9,Tablet inventory Store
3635,"Lenovo XiaoXin P11 Pro планшет, экран 2021 дюймов, Восьмиядерный, 6 ГБ ОЗУ 870 Гб ПЗУ","31 274,78",,,ShenZhen Mi-Jia Store
3636,"Планшет на Android 10,1, восемь ядер, экран 9,0 дюйма, 4 Гб + 64 ГБ","6 053,18",,,ShenZhen BDF Tablet Technology Co. Store
3637,"Новейший планшет 2 в 1 P30 10 дюймов 1920*1200 IPS Android 10,0 OS 8 ГБ + 128 Гб 13/5MP Двойная камера Bluetooth 4G SIM планшетный ПК","11 545,89","3,0",2,BEESITTO Global Offical Store
3638,"Планшет на Android, восемь ядер, экран 10,1 дюйма, 4 Гб + 64 ГБ","8 091,93",,,CN GO GO Jiuliuyar Store
3639,"Планшет на android 10,0, восемь ядер, экран 128 дюйма, 6 ГБ + 10,1 ГБ","12 240,18",,,A Men Store
3640,"Оригинальный прочный диагностический планшетный ПК K10U, водонепроницаемый промышленный компьютер на Windows 10, 10,1 дюйма, I5-8250U, 8 Гб ОЗУ, 128 Гб SSD, ...","109 910,13",,,XDrone Tablet Store
3641,"Планшет с экраном 10,1 дюйма, 3G, 4 Гб + 64 ГБ, Android 7,0, Восьмиядерный процессор, Wi-Fi, GPS, FM, Bluetooth","6 658,50",,1,BDF Official Store
3642,"Оригинальный телефон Lenovo E8 TB-8304F1, 8 дюймов, 2 Гб + 16 ГБ, Android 7,0, MediaTek MT8163B ядра с тактовой частотой до 1,3 ГГц, планшетов, ПК","8 966,98",,,aForChina Store
3643,"Планшет CARBAYTA, 10,1 дюйма, 128 ГБ, TF-карта, средний компьютер дюйма, Bluetooth, Wi-Fi, планшет на Android 9,0, 2.5D, CE Band, 32 ГБ, компьютер","15 846,17",,,Tablet and laptop sales service center Store
3644,"Оригинальный игровой Планшет Lenovo Legion Y700, 8,8 дюйма, 120 Гц, Восьмиядерный процессор Snapdragon 870, фронтальная камера 8 Мп, задняя камера 13 МП, 6550 мАч, ...","31 188,61",,1,Shenzhen Pophong Store
3645,"Samsung Galaxy Tab A7 Lite 32 ГБ, серебристый цвет (быстрая доставка), 8,9 в, 4 Гб ОЗУ, емкость аккумулятора 5100 мАч","12 610,10","5,0",1,Koc market Store
3646,"Штепсельная Вилка стандарта ЕС/США, портативная нетбук Windows 10 10,1 дюйма, поддержка tf-карты с четырехъядерным процессором Intel/2 ГБ + 64 Гб/Wi-Fi/ BT/ HD","10 406,71",,1,High Tech Store
3647,"Планшет, 10 дюймов, Android 2020, Восьмиядерный процессор, 6 ГБ + 32 Гб ПЗУ, 4G, FDD, LTE, две SIM-карты, экран 2.5D, Wi-Fi, Bluetooth, GPS, 9,0","8 658,72",,,LSKDZ Tablet PC Store
3648,"Планшетный ПК, 10 дюймов, Android 2020, 9,0 МП, 1280x800 IPS, 10,1 дюйма, 3G, две SIM-карты, телефонные звонки, Google Market, Wi-Fi, GPS + подарок","9 973,04",,,WLWY Store
3649,"Дешевый планшет BDF Pro, 10,1-дюймовый планшет с функцией телефонного вызова, ПК, Android 10,1, Play Store, 4 ГБ/64 ГБ, Восьмиядерный, GPS, IPS, Android планшет 10","6 500,17",,,BDF BDF Tablet Global Store Store
3650,"Планшетный ПК Lenovo M10 PLUS, 10,3 дюйма, Full HD, 4 Гб + 128 Гб, поддержка студенческого режима, Германия, Rheinland Eye Pad, планшет интернет-класса, Wi-Fi","15 065,70",,,Samsung1 Earphone Authentication Store
3651,"Планшет M107 на Android 2022, восемь ядер, экран 10 дюймов, 6 ГБ + 64 ГБ","18 047,46",,,Tablet Factory Store
3652,"Планшет с ОЗУ 6 Гб ПЗУ, 128 ГБ, 10,1 дюйма, 1920*1200, 8000 мАч, 10-ядерный процессор, Android 10,0, планшет, 4G Lte, двойная камера 5 Мп + 13 МП","10 418,62","5,0",,Baby Doing Buy Store
3653,"Планшет с 10,1-дюймовым дисплеем, ОЗУ 6 ГБ, ПЗУ 9,0 ГБ, 10,1 мАч, Android 5000","6 239,54",,,delicate tablet store Store
3654,"Планшет Google Play, ОС Android 2020, 10-дюймовый экран, Восьмиядерный процессор, 4 Гб ОЗУ, 64 Гб ПЗУ, 9,0*1280 IPS, для детей, 3G, 4G, LTE, планшеты 10, 800","13 169,88",,,"Shenzhen HongyangTechnology Co., Ltd."
3655,Планшет Samsung Galaxy Tab A7 Lite LTE 32GB,"14 990,00","5,0",13,Связной - официальный магазин
3656,"10,1-дюймовый IPS планшет с четырёхъядерным процессором W8100, ОЗУ 2 Гб, ПЗУ 32 ГБ, 10,1x1280","9 037,74",,1,DIGITALTOOLS Technology Ltd. 
3657,"Планшет на Android 2022, восемь ядер, экран 10,1 дюйма, 4G LTE","8 342,04",,,ShenZhen BDF Tablet Technology Co. Store
3658,"2022 высококачественный планшетный ПК HUAWEI MatePad 10,4 дюйма, совместное использование нескольких экранов, 4 лайнера, стандартный модуль, слот Wi-Fi 6,...","23 091,78",,,Xiao-Mi- Store
