,title,price,score,sold,store
485,Global ROM Lenovo Tab P11 K11 или Xiaoxin Pad 11-дюймовый ЖК-экран 2K Планшет Android 6 ГБ 128 ГБ Qualcomm Snapdragon 662 7700 мАч WiFi,"13 380,76","4,7",49,Lenovo Official Store
486,"Планшетный ПК с навигацией Navitel T737 PRO 7"" Android 9.0 3G","8 990,00",,,NAVITEL Store
487,"Глобальная версия планшета Xiaomi Pad 5 Snapdragon 860 120 Гц 11 дюймов WQHD + 2,5 K ЖК-дисплей 6G 128G/256G 22,5 W быстрое зарядное устройство 8720mAh","24 661,12","4,8",150,Dragon-X Store
488,"Планшет на Android 10,1, восемь ядер, экран 128 дюйма, 8 ГБ + 10,0 ГБ","6 165,28",,,Gifts Tablet Pc Store
489,"Графический планшет VEIKK A30, 10x6 дюймов, Поддержка Android, Mac, Linux","3 668,34","5,0",35,Graphic Tablet Drawing Store
490,"Детский планшет weeliaksi, 8 дюймов, Android 11, 1280x800, IPS, 2 + 32 ГБ, 4 ядра, 4500 мА · ч, Wi-Fi, 6 дюймов, с подставкой","5 398,82","5,0",3,weelikeit Official Store
491,"Планшет на Android 9, восемь ядер, экран 10,1 дюйма, 4 Гб + 64 ГБ","5 912,36","5,0",3,"SHENZHEN BDF TOUCH TECHNOLOGY CO.,LTD."
492,"Планшет с 11 дюймовым дисплеем, ОЗУ 12 Гб, ПЗУ 512 ГБ, Android 10,0","7 356,30",,1,Shop1100048106 Store
493,"BDF 2022 новый 10,1 дюймовый планшетный ПК IPS 4 ГБ ОЗУ 64 Гб ПЗУ Восьмиядерный 4G LTE сетевые звонки Bluetooth WiFi GPS Pro планшет Android 11,0","7 532,85","5,0",2,ShenZhen BDF Tablet Technology Co. Store
494,"Графический планшет HUION HS611, 3 цвета, цифровой планшет для рисования, мультимедийные клавиши, медиа-панель, стилус без батарейки с функцией на...","5 280,42","4,9",301,HUION Store
495,"10-дюймовый планшет с четырёхъядерным процессором 3G, ОЗУ 6 ГБ, ПЗУ 2022 ГБ, 5 МП, Android 128","6 239,54",,,delicate tablet store Store
496,"Планшет Blackview Tab 11 DK032, 8 + 128 ГБ, 10,36 дюйма, 2K, 6580 мАч","13 936,34","4,9",115,Vshop
497,Графический планшет WACOM Intuos Pro Medium Paper Edition (PTH-660P) Ростест (EAC) черный,"35 300,00",,,Shop-device Store
498,"Lenovo XiaoXin Pad Pro планшет, Восьмиядерный, 6 ГБ 128 ГБ, экран 11,5 дюйма","21 656,95",,,Samsung1 Earphone Authentication Store
499,"Светодиодная доска для рисования, детские игрушки для рисования, 3 уровня, планшет для письма с регулируемой яркостью, образовательная игра ...","692,19","5,0",10,"RainbowTechnology Co.,Ltd Store"
500,"Планшет Blackview TAB 10 Pro, 10,1 дюйма, 8 + 128 ГБ, 1200x1920, Android 11, 6580 мА · ч, 30 Вт","14 501,72","4,7",31,BLACKVIEW Official Store
501,"Планшет с 10,1-дюймовым дисплеем, ОЗУ 6 ГБ, ПЗУ 10,1 ГБ, Android 128, 4G LTE","5 828,99",,,Gifts Tablet Pc Store
502,Facebook GPDMicro ПК 6 дюймов Windows 10 Pro 8 Гб RAM / 256 ГБ ROM мини ноутбук карманный компьютер,"29 586,34",,,HIPERDEAL Smarter Life Store
503,"Новинка, планшетофон, Android 11,0, 10 ядер, 12 Гб ОЗУ, 512 Гб ПЗУ, 1920*1200, две SIM-карты, GPS, 10-дюймовый планшетный ПК","12 610,10",,1,WanChaoRui Store
504,"Чехол с защитой от падения для Apple iPad Pro 11 2021/2020, чехол для планшета, вращающаяся подставка, вертикальная поддержка Air 5/4 10,9 дюйма 2022","1 260,38",,,Practical Design Store
505,"10-дюймовый планшет глобальная версия M40 Pro, Android, 12 Гб ОЗУ, 512 Гб ПЗУ, планшеты 4G, сеть 1920x1200, десять ядер, Type-C, телефон, планшетный ПК","9 975,84",,,WLWY Store
506,"Планшетный ПК 12 Гб ОЗУ + 512 Гб ПЗУ M50 планшетный компьютер android 10 дюймов электронные Планшеты Android 11,0 планшетный 10-ядерный планшет распродажа","11 159,86",,,LSKDZ Tablet PC Store
507,"Новый Популярный обновленный планшет 10,1 дюймов 6G + 128 Гб, двойной Wi-Fi ПК Android 9,0, двойная SIM-карта, телефон, планшет, подарки","6 163,88",,,Gifts Tablet Pc Store
508,"5G Wi-Fi Планшеты планшетный ПК 10 дюймов Android 8,0 1920*1200 10 Deca Core, размер экрана MTK6797 6 ГБ Оперативная память 128 Гб Встроенная память Тип-C GPS Wi-Fi Поддерж...","12 374,70","5,0",3,Science JNMD Store
509,"Планшет Графический детский портативный с ЖК-дисплеем, 8,5/12 дюймов","331,54","5,0",17,LECSION Store
510,"Планшет на Android 8800, экран 10,1 дюйма, 512 ГБ","10 527,92",,,Tablet PC Global Version Store
511,"Планшет R10 MTK6762 с двумя SIM-картами, 10,1 дюйма, 512 ГБ, Android 11","8 617,38",,,Global Smart Tablet Online Store
512,"Планшет 17T Nланшет Android 8,1 Google Play 4G LTE PC SIM GPS Word Office 6 ГБ ОЗУ 128 Гб ПЗУ 10 ядер новая стандартная деталь Wifi 10,1 дюймовая панель","9 878,46",,,Global Smart Tablet Online Store
513,"Планшет игровой V96, 6000 мАч, 9,6 дюйма, 8 + 128 ГБ, две Sim-карты","8 337,14",,,Global Smart Tablet Online Store
514,"Графический планшет VEIKK VK1060Pro, 10x6 дюймов, 8192 уровня, ручка без батареи, Поддержка Android, Windows, Mac, цифровой планшет для рисования","4 640,07",,1,Graphic Tablet Drawing Store
515,"10,1-дюймовый Планшет M33 WIFI 10,1 мАч 6000 Гб ROM Android 11 GPS Google Play 4G","11 576,71",,,Global Smart Tablet Online Store
516,"Планшетный ПК T16, десятиядерный, Android 11, MTK X30, 10,1 дюймов, GPS, 8600 мАч, нетбук, 12 Гб, 512 ГБ, 4G/телефон, ноутбук","9 971,64",,,FAUST Global Online Store
517,"Планшет с 10,1-дюймовым дисплеем, ОЗУ 12 Гб, ПЗУ 8000 ГБ, Android 10","6 032,17","4,4",18,FAUST Global Online Store
518,"7,1 дюймовый планшет K50 Android 12 Google Play 12 ГБ 512 Гб WIFI 8600 мАч 24 + 48 Мп нетбук две SIM-карты Deca Core Qualcomm 870 распознавание лица","5 826,89",,1,FAUST Global Online Store
519,"Чехол для планшета с сенсорной панелью для iPad Pro12.9 2021 11 Air3 Air4 10,2 10,5 10,9 дюймов, защитный чехол для планшета, клавиатура для ipad","3 677,45","3,7",14,SASORIZA Samfun Store
520,"Планшет S7 +, экран 8,1 дюйма, 8000 мАч, 128 Гб ПЗУ, WPS, на базе Android 10,1, камера 16 + 32 МП, Wi-Fi, Google Play","6 802,83","5,0",16,FAUST Global Online Store
521,"Планшет на Android 9, восемь ядер, экран 10,1 дюйма, 4 Гб + 64 ГБ","5 744,92","5,0",2,SHENZHEN BDF Tablet Store
522,"2022 оригинальный промышленный Прочный планшетный ПК Kcosit K7G Windows 10 Pro Win10 Intel N4120 10,1 дюймов HD 8 ГБ ОЗУ 128 Гб WiFi RS232 USB 3,0","34 148,65","5,0",11,KT Technology
523,"Оригинальный игровой Планшет Lenovo LEGION Y700 Legion 2022, 8,8 дюйма, 6550 мАч, 45 Вт, зарядка 2560*1600, планшет для одной руки","36 562,91","4,7",72,Lenovo Online Store
524,"Противоударный чехол для Samsung Galaxy Tab A7 10,4 2020 дюймов","1 541,32",,,Mascots Store
525,"Планшет, 2022 дюйма, 6 + 10,1 ГБ, 4G, Wi-Fi, Android 128","6 163,88",,,Gifts Tablet Pc Store
526,"ALLDOCUBE iPlay 40 Pro планшетный ПК 10,4 дюйма 2000*1200 IPS Android 11 8 Гб RAM 256 ГБ ROM Octa Core T618 4G Lte телефонные звонки планшеты","15 179,20","5,0",5,ALLDOCUBE Flagship Store
527,"Планшет с 10,1-дюймовым дисплеем, восьмиядерным процессором, ОЗУ 6 ГБ, ПЗУ 2022 ГБ, Android 10,1, 2-мя слотами для SIM-карт","6 088,21","5,0",11,Gifts Tablet Pc Store
528,"Тачскрин для Asus ME175CG MeMo Pad 7 , 5472L FPC-1 Rev.2 черный","614,00",,1,sota-service Store
529,"Цифровой графический планшет ARTISUL A1201, 10x6,3 дюймов, доска для рисования и игр OSU с 8192 уровнями, ручка без батареи","3 432,24","5,0",4,ARTISUL Official Store
530,"CHUWI HiPad планшет на Android 11, восемь ядер, Unisoc T618, экран 10,1 дюйма, 6 ГБ LPDDR4, 128 ГБ eMMC планшет для игр и детей","13 824,94",,5,CHUWI Official Store
531,"Планшет 10 дюймов, 8 ядер, 4G, 6 ГБ + 64 ГБ, Android 10,0","13 999,00",,1,Market Lid Store
532,"Планшеты Xiaomi Mi Pad 5, глобальная прошивка, 128 ГБ/256 ГБ, процессор Snapdragon 860, экран 5 дюймов 2,5 K, планшет, 13 МП, аккумулятор 8720 мАч, китайская версия","21 298,24","4,9",133,Xiaomi Live Store
533,"Планшет с 10,1-дюймовым дисплеем, ОЗУ 8 Гб, ПЗУ 10,1 ГБ, Android 11","11 597,73",,,LSKDZ Tablet PC Store
534,"100% оригинал, стилус Xiaomi, записывающий скриншот, 240 Гц, 152 мм, 18 мин, полностью заряженный планшет, умная ручка для Mi Pad 5 и 5 Pro","3 659,23","5,0",112,Wisetech Online Store
535,"Планшет 10.1 дюймовая сим-карта Дюймов, двойная камера 9,0*1280 IPS, wifi, GPS, Android 800, Google play, 10-дюймовый планшет для детей, подарок","9 973,04",,,WLWY Store
536,"Планшет Alldocube iPlay 40 H, 10.4 дюймов, 8 + 256 ГБ, Unisoc T618 8 ядер, Android 11, 2000*1200 IPS технология полного прилегания высокочистый экран, 4G LTE позвонить, играть в...","13 310,70","4,9",126,ALLDOCUBE Digital Store
537,"Новинка 2022, планшетный ПК Pro Android 9,0, умный ноутбук, 10,1 дюйма, ОЗУ 6 Гб ПЗУ, 128 ГБ ОЗУ, 4G, две SIM-карты, Ультратонкий экран","6 280,18","5,0",1,delicate tablet store Store
538,"Планшет Google Play на Android 2022, восемь ядер, экран 9,0 дюйма, 6 ГБ + 10,1 ГБ","6 239,54",,,delicate tablet store Store
539,"Luxury Case For Microsoft Surface Pro 8 13""2021 Tablet Case Pu Leather Cover Surface Pro 7 6 5 4 Go 1 2 3 Business Sleeve Fundas","1 188,92",,2,Greliana Outlet Store
540,"8-дюймовый планшет с четырёхъядерным процессором, ОЗУ 1 ГБ, ПЗУ 16 ГБ, Android 7,1","4 317,10","5,0",34,Tablet inventory Store
541,"Планшет глобальная версия, 10-дюймовый, 10-ядерный, 10,1 дюйма, Android, 13 МП, GPS, 4G","8 903,22",,,Nenmone Official Store
542,"Планшет Teclast P80, 8 дюймов, Android 10, AllwinnerA133, двухдиапазонный, Wi-Fi, 1280x80 0 IPS, четыре ядра, Bluetooth 5,0, 2 Гб ОЗУ, 32 Гб ПЗУ","5 325,96","5,0",7,Teclast official-Global Store
543,"Планшет с 10-дюймовым дисплеем, восьмиядерным процессором, ОЗУ 6 ГБ, ПЗУ 32 ГБ, 5,0 D, Android 9,0","14 501,72",,2,"Shenzhen HongyangTechnology Co., Ltd."
544,"Чехол для Lenovo Tab P11 Plus, чехол для детского планшета EVA, чехол для планшета Lenovo Tab P11, искусственная кожа, 11 дюймов, безопасный, с защитой от паден...","807,79","4,9",328,XunyLyee Store
545,"Nenmon Tab K50 планшет с 5,5-дюймовым дисплеем, восьмиядерным процессором MT6750, ОЗУ 4 Гб, ПЗУ 64 ГБ, 13 МП + 5 МП, 4G LTE, GPS","10 312,13",,,Nenmone Official Store
546,"Планшет на Android 10, восемь ядер, экран 2022 дюйма, 4 Гб + 64 ГБ","7 160,13","3,5",4,ShenZhen BDF Tablet Technology Co. Store
547,"Нетбук 10,1 дюйма Intel Quad Corer 32 Гб ультратонкий светильник, нетбук Intel Z8350 CPU PC HDMI WiFi USB Windows10","9 955,53","4,9",34,SZ BDF TabletS Store
548,"Смартфон Snapdragon 845, планшетный ПК, Android 11, 10,1 дюйма, HD, 4K, 8 + 128 ГБ","10 930,76",,,WLWY Store
549,"Чехол для планшета с сенсорной панелью для iPad Pro11 air3 10,2 9,7 10,5 12,9 дюймов, защитный чехол для планшета ipad, чехол для клавиатуры","2 745,65",,5,SASORIZA Samfun Store
550,"Новый Популярный 2022 дюймовый планшет 6G + 10,1 ГБ Android 128 Восьмиядерный HD WiFi Две SIM-карты Бесплатная доставка планшет Android 9,0","6 163,88","5,0",1,Gifts Tablet Pc Store
551,2022 новый игровой планшет Android 11 12 Гб RAM + 512 ГБ ROM десятиядерный 4G сеть 5GWifi планшетный ПК,"9 975,84",,,WLWY Store
552,"Планшет на Android 9, восемь ядер, экран 10,1 дюйма, 4 Гб + 64 ГБ","6 187,70","5,0",15,SHENZHEN BDF Tablet Store
553,"Новая распродажа, док-клавиатура 11,6 дюйма для планшета G12 Next Book 2 в 1","1 733,98","5,0",9,Tablet inventory Store
554,"Чехол для iPad 9,7 2017 2018, сверхмощный противоударный чехол для детей, чехол для планшета для iPad Pro 9,7 дюйма 5-го поколения с плечевым ремнем","1 593,86",,,Mascots Store
555,"2022 супер 2.5D стекло 6G + 128 Гб планшетный ПК Google Play 10,1 дюймов Android 9,0 Восьмиядерный 4g Смартфон Android 9,0 GPS WIFI планшеты","6 088,21",,2,Gifts Tablet Pc Store
556,"Teclast M16 10,1-дюймовый планшет с десятиядерным процессором Helio X27, ОЗУ 4 Гб, ПЗУ 11,6 ГБ, 128 мАч","9 037,74","4,6",44,Teclast Official Store
557,"Планшет Xiaomi 4, Оригинальный планшет HD, процессор Snapdragon 660, AIE, Bluetooth 5,0, Аккумулятор 6000 мА · ч","15 938,65","5,0",24,China Seagates Authentication Store
558,"Планшеты 2 в 1, 10,1-дюймовый экран Android игровой планшетный компьютер Helio X27, десятиядерный Ips G + G 10,8*2560, 2k экран, клавиатура Type-C","10 744,40","4,8",5,lenmon tablets Store
559,"Планшет Графический Artisul D16 PRO, 15,6 дюйма, с клавишами быстрого доступа и циферблатом","19 714,88",,1,ARTISUL Official Store
560,"Планшет Alldocube iplay40 H, Android 11, 8 + 128 ГБ, 10,4 дюйма, 2K","13 310,70","4,6",11,ALLDOCUBE Direct Store
561,"Blackview Tab 10 Pro планшет, экран 10,1 дюймов, 8 Гб ОЗУ 128 Гб ПЗУ, Android 11, MT8788V, 6580 мАч, 30 Вт","14 606,11","5,0",12,Vshop
562,[Официальная гарантия] планшет Xiaomi Pad 5 6+128 Гб | Дисплей WQHD+ 120Гц | Аккумулятор 8720 мА-ч(тип.),"27 990,00","4,8",14,Shop912178360 Store
563,"Притомья K7 7 дюймов Детские Планшеты Android 10,0 ПК 1 Гб Оперативная память 16 Гб Встроенная память 4 ядра Планшеты Wi-Fi, Bluetooth, Dual Камера с Детские пл...","5 229,98",,1,PRITOM Global Store
564,"Чехол для Realme Pad 10,4 дюйма, тонкий трехскладной Умный Магнитный чехол для планшета Realme Pad 2021 10,4, защита от падения, чехол + подарок","580,80","4,6",30,Bangweey HminSen Store
565,"Планшет Pro на Android 10,1, восемь ядер, экран 9,0 дюйма, 4 Гб + 64 ГБ","5 674,86","5,0",14,ShenZhen BDF Tablet Technology Co. Store
566,"Быстрая доставка, телефон с планшетом realme на 24 часа, 4 ГБ, 64 ГБ, Helio G80, дисплей 10,4 дюйма WUXGA +, широкоугольная камера 8 Мп, 7100 мАч","17 094,64","4,4",20,realme Official Online Store
567,"7-дюймовый планшет BDF для детей, лучший подарок, игры, приложения для детей, планшет Android, Wi-Fi, четырехъядерный, Обучающий планшет для детей","3 180,02","5,0",8,BDF BDF Tablet Global Store Store
568,"Blackview Tab 12 планшет с 10,1-дюймовым дисплеем, восьмиядерным процессором, ОЗУ 4 Гб, ПЗУ 64 ГБ, 13 МП, 10,1 мАч","10 508,30","5,0",8,BLACKVIEW Authorizing Store
569,"Ультратонкий Магнитный смарт-чехол для iPad mini 6 Pro 11 12,9 2021 mini 6 Air 5 4","704,80","4,6",573,AJIUYU Official Store
570,Teclast T40 Plus 10.4'' Планшет 2000x1200 IPS Android 11 UNISOC T618 Octa Core 8 ГБ оперативной памяти 128 ГБ памяти 4G Call Type-C Планшеты для ПК для Android для Xiaomi для Huawei для планше...,"13 090,01","4,9",110,Teclast Global Store
571,"Планшеты Xiaomi Mi Pad 5, глобальная прошивка, 128 ГБ/256 ГБ, процессор Snapdragon 860, экран 5 дюймов 2,5 K, планшет, 13 МП, аккумулятор 8720 мАч, китайская версия","27 043,16","4,9",133,YouGeek Store
572,"Lenovo XiaoXin Pad Plus телефон, экран 11 дюймов, 6 ГБ ОЗУ 128 Гб ПЗУ, Восьмиядерный","28 023,30","5,0",9,Creativehome
573,"Blackview Tab 6 детский планшет, экран 8 дюймов, 3 Гб + 32 ГБ, Android 11","10 486,58",,1,WTYD Store
574,"Оригинальный стилус Xiaomi 240 Гц, рисование, Скриншот для письма, 152 мм сенсорный экран планшета Xiaomi Smart Pen для Xiaomi Mi Pad 5 / 5 Pro","3 756,62","4,9",3659,EHeng Store
575,2021 новый супер 2.5D Закаленное стекло 10 дюймов 4G LTE планшетный ПК Octa Core 4 Гб RAM 32 ГБ ROM 1280x80 0 IPS 5.0MP WiFi Bluetooth,"8 667,12",,,WKS Store
576,"【Новейший】 ALLDOCUBE iPlay 40 Pro 10,1-дюймовый планшет Android 11 2K 10,4x2000 FHD 8 ГБ ОЗУ 1200 Гб ПЗУ UNISOC T618 OctaCore 4G LTE Dual Wifi","17 047,00","5,0",8,ALLDOCUBE Factory Store
577,"Планшет с 10,1-дюймовым дисплеем, ОЗУ 6 ГБ, ПЗУ 9,0 ГБ, 10,1 мАч, Android 5000","6 239,54",,,delicate tablet store Store
578,"Планшет BDF P30 Pro на Android 11, восемь ядер, экран 10,1 дюйма, 4 Гб + 64 ГБ","8 360,96","4,8",29,"SHENZHEN BDF TOUCH TECHNOLOGY CO.,LTD."
579,"Графический планшет UGEE с экраном 12 дюймов, цифровой планшет для рисования UGEE 127%, RGB экран для дизайна рисования","13 834,75","5,0",5,UGEE Official Store
580,"Планшет глобальная версия TCL 10 TABMAX, экран 10,36 дюйма FHD IPS, 15:9, 8000 мАч, 4 ГБ/64 ГБ, MT8788, Wi-Fi, камера 13 МП AF, Android 10, Office","10 649,12","4,9",18,Golden-Tech Store
581,"Планшет Teclast M40 на Android 10, 1920x1200, экран 10,1 дюйма, 4G, 6 ГБ ОЗУ, 128 Гб ПЗУ, Восьмиядерный процессор UNISOC T618, Двойной Wi-Fi, USB Type-C","10 512,50","4,5",61,Teclast Official Store
582,Графический планшет Parblo Intangbo M Stars Black,"8 399,00",,,Parblo Official Store
583,"Планшет Lenovo Tab P11 Pro Xiaoxin Pad Pro, Восьмиядерный процессор Snapdragon 730, 6 Гб/128 ГБ, экран 11,5 дюйма 2,5 K, 8500 мАч, глобальная прошивка, планшет Android","28 653,84",,3,MeMall Store
584,"Чехол для планшета Microsoft Surface Pro 8, 13 дюймов, с сенсорным экраном 2021","1 540,62","5,0",16,3-Clouds Store
585,"Глобальная версия планшет G20 Google Play 8 Гб 128 ГБ MTK6750 Восьмиядерный WIFI 6000 мАч 10,1 дюймов ноутбук ПК 48 МП GPS WPS Android 11 Pad","10 209,84",,,Global Smart Tablet Online Store
586,"Планшет Google Play T10 MTK6762 с двумя SIM-картами, 10,1 дюйма, Android 11, 4G, большой экран, 6000 мАч, Wi-Fi, 128 Гб ПЗУ, скачка, горячая Распродажа","8 819,15",,,Global Smart Tablet Online Store
587,"Глобальная версия планшет G20 Google Play 8 Гб 128 ГБ MTK6750 Восьмиядерный WIFI 6000 мАч 10,1 дюймов ноутбук ПК 48 МП GPS WPS Android 11 Pad","10 209,84",,,Global Smart Tablet Online Store
588,"H50 телефон, планшет, Восьмиядерный процессор MTK 6771, 6000 мАч, 12 Гб, 512 ГБ, 10 дюймов, Android 11, камера 24 + 48 МП, Google Play","11 491,24",,,Global Smart Tablet Online Store
589,"Чехол для Xiaomi Mi Pad 5 Pro 5, Прочный противоударный чехол для планшета Mi Pad 5 Pro 2021, 11 дюймов, чехол для Mi Pad 5","592,62",,2,WM Co Ltd-tech Store
590,10-дюймовый планшетный ПК H30 24 + 48 Мп 6000 мАч Google Play 8 ГБ 128 Гб WIFI глобальная версия ноутбук MTK6771 Android 11 GPS 8-ядерный планшет,"9 266,84",,,FAUST Global Online Store
591,"Планшетофон 8600 мАч, 7,1 дюйма, 6 ГБ, 128 ГБ, Android 12, Google Play, Qualcomm 870, десятиядерный ноутбук","5 826,89",,1,FAUST Global Online Store
592,"Планшет S7 + WPS на Android 8,1, экран 128 дюйма, 10,1 ГБ","6 102,23","4,6",25,FAUST Global Online Store
593,Чехол для планшета с подставкой для клавиатуры,"560,48","5,0",8,FAUST Global Online Store
594,"Планшет Графический Artisul D22S, 21,5 дюйма, без аккумулятора, 8192 уровня","25 171,16","2,0",3,ARTISUL Official Store
595,"Планшет G8811 на Windows 10, четыре ядра, экран 10,1 дюйма, 2 ГБ + 32 ГБ","6 858,87","5,0",26,Tablet inventory Store
596,"ALLDOCUBE M5XS планшет на Android, экран 10,1 дюйма, 3 ГБ + 32 ГБ","6 235,34","5,0",9,ALLDOCUBE Digital Store
597,"Бесплатная доставка, планшетный ПК на базе Android 11,0, 12 Гб ОЗУ, 512 ПЗУ, 11 дюймов, 4k HD экран, планшет, телефон с двумя SIM-картами или Wi-Fi","11 664,99",,,LSKDZ Tablet PC Store
598,"Планшет на Android 2022, экран 10,0 дюйма, 8 ГБ + 10,1 ГБ","6 095,22",,,Gifts Tablet Pc Store
599,"Активный стилус для Ipad, сенсорный экран для Apple Pencil 2 1 iPad Pro 11 12,9 2020 2018 2019 6-го 7-го","1 189,62","4,6",154,Hineshun Store
600,"Teclast P85 планшет на Android 11, четыре ядра, экран 8 дюймов, 2 Гб + 32 ГБ","6 584,94","4,4",23,Teclast Official Store
601,"Teclast P20HD планшет на Android 10, восемь ядер, экран 10,1 дюйма, 4 Гб + 64 ГБ","9 774,77","4,9",59,Teclast Official Store
602,"Планшет T16 Pro на Android 11, 10,1 дюйма, 8 + 128 ГБ, Wi-Fi, 8600 мА · ч","10 857,20","5,0",1,LUKAS Global Store
603,"Планшет Xiaomi Mi Pad 5 Pro, 8 Гб 256 ГБ, Snapdragon 870, ЦП, планшеты с экраном 11 дюймов 2,5 K, 5 Pro, телефон с аккумулятором 8600 мАч, зарядка 67 Вт","65 295,92",,,Hong Kong Goldway
604,Графический планшет для рисования 10moons G10 10*6 дюймов с пассивным пером 8192 уровней Поддержка Android 12 Экспресс-клавиш и 10 медиа-клавиш,"4 693,32","5,0",4,"ChuMoTechnology Co., Ltd Store"
605,"LENOVO XiaoXin Pad P11 PRO планшет, экран 2022 дюйма, 6 ГБ + 10,6 ГБ","21 178,44",,1,Lenovo Tech Online Store
606,"10,1-дюймовый Планшет M1015 Windows 10, 1 ГБ DDR + 32 ГБ, док-клавиатура Nextbook, стандартная четырехъядерная Wi-Fi","5 835,30","5,0",6,Tablet inventory Store
