,title,price,score,sold,store
2440,"Планшет на Android 10, 16 ГБ ОЗУ, ТБ ПЗУ, 11 дюймов, 4k HD экран, телефон с двумя SIM-картами или Wi-Fi, с клавиатурой Bluetooth","9 247,92",,,jaysong tablets global Store
2441,"Планшет Pro 11 дюймов 12 Гб ОЗУ динамик телефон 512 Гб ПЗУ Планшеты Android 10,0 двойной вызов GPS Bluetooth Google Play","7 356,30",,,jaysong tablets global Store
2442,"Планшет Pro на Android 10, 12 Гб ОЗУ 256 Гб ПЗУ","9 317,98",,,jaysong tablets global Store
2443,"Планшет с 10,1-дюймовым дисплеем, десятиядерным процессором, ОЗУ 6 ГБ, ПЗУ 2022 ГБ, Android 128, 5 Мп","6 176,49",,,100% tablet Store
2444,Оригинальный Lenovo TianJiao Pad 11-дюймовый планшет TB-J616F 6 ГБ 128 ГБ ZUI13 Android 11 MediaTek Helio G90T Octa Core 13MP 7700 мАч,"18 914,80",,4,Tablet PC Mall
2445,"Планшет Lenovo Tab P11 Pro, глобальная прошивка, 6 ГБ 128 ГБ, 11,5 дюйма, 2,5 K OLED","36 851,56",,,Samsung1 Earphone Authentication Store
2446,"Huawei MatePad 10,1-дюймовый планшет с восьмиядерным процессором kirin 10,4, ОЗУ 4/6 ГБ, ПЗУ 128 ГБ, Android 10, 810 мАч","26 463,06",,,Huawei online Store
2447,"10-дюймовый планшет с четырёхъядерным процессором, ОЗУ 32 ГБ, ПЗУ 2 SIM-карты, Android 2020","11 908,80",,,"Shenzhen HongyangTechnology Co., Ltd."
2448,"Планшет с 10,1-дюймовым дисплеем, 10-ядерным процессором, ОЗУ 6 ГБ, ПЗУ 9,0 ГБ, 5 МП, 4G LTE, Android 10,1","6 239,54",,,delicate tablet store Store
2449,"Новый сотовый телефон i13 Pro Max, 6,7 дюймов, U-экран, 4G, телефон, телефон, мобильный телефон, Android 10, дешевые мобильные телефоны","7 562,28",,2,LSKDZ Tablet Online Store
2450,"Планшет с 10,1-дюймовым дисплеем, ОЗУ 8 Гб, ПЗУ 2022 ГБ, 2-мя слотами для Sim-карт","10 630,90",,,LSKDZ Tablet Online Store
2451,"Игровой планшет Lenovo LEGION Y700 TB-9707F 8,8 дюйма, 8/128 ГБ, 12/256 ГБ, ZUI13, Android 11, Qualcomm Snapdragon 870, Восьмиядерный, в наличии","42 735,90",,2,Tablet PC Mall
2452,"10,1 дюймовый NX16A 2GBDDR3 + 32 ГБ Windows 10 Home Z8350 CPU Двойная камера Bluetooth-совместимый WIFI 5000 мАч подарочные наушники & Чехол","7 706,60","4,7",9,Tablet inventory Store
2453,"Планшет Lenovo Xiaoxin Pad Plus 5G 11 дюймов, Wi-Fi, ЖК-экран, Восьмиядерный процессор Snapdragon 750G, 6 ГБ ОЗУ, 128 Гб ПЗУ, 7700 мАч, Android 11","26 622,10","5,0",17,eForChina Store Store
2454,BQ BQ 1085L Планшет 85961793,"8 597,11",,,ATbook Store
2455,"Планшет на Android 10, восемь ядер, экран 2022 дюйма, 4 Гб + 64 ГБ","7 160,13","3,5",4,ShenZhen BDF Tablet Technology Co. Store
2456,"Планшет, экран 10,1 дюйма, 2 Гб ОЗУ 32 Гб ПЗУ, Восьмиядерный процессор SC9863A, IPS-экран 9,0x1280, Android 800","6 935,94",,,SHENZHEN BDF Tablet Store
2457,"Планшет на Android 10,1, восемь ядер, экран 9,0 дюйма, 6 ГБ + 128 ГБ","6 239,54",,,delicate tablet store Store
2458,"Nextbook NX16A 10,1-дюймовый планшет с четырёхъядерным процессором, ОЗУ 1/2 ГБ, ПЗУ 32 ГБ, 10,1x5000","7 346,49",,1,"Galavey Electronics Co, Ltd"
2459,"Планшет 2.5D, ОЗУ 8 Гб, ПЗУ 128 ГБ, 10-дюймовый экран, 3G/4G LTE, две SIM-карты, Android 9,0, 10-ядерный процессор, планшеты, GPS, Wi-Fi, Bluetooth 10,1","9 465,11",,1,LSKDZ Tablet Online Store
2460,"CHUWI HiPad X планшет, экран 10,1 дюймов, Android 11,0, Восьмиядерный, 6 ГБ ОЗУ 128 Гб ПЗУ","13 150,26","5,0",10,CHUWI Global-Flagship Store
2461,"Планшетный ПК 4G LTE, 10,1 дюймов, Android OS 9,0, Google Play, 4G, телефон с двумя SIM-картами, GPS, Bluetooth, Wi-Fi, игровой планшет","9 170,85",,,Shenzhen Fuloophi Store
2462,"Lenovo Смарт планшет E8 TB 8304F/N 8 дюймов 2G / 3G RAM 16G / 32G ROM Octa Core WiFi /LTE версия 4850 мА/ч, 5.0MP 10-точки Мульти-сенсорный экран","6 394,38",,1,Egoo Store
2463,"Новинка 7-дюймовые планшеты 2 ГБ/16 ГБ четырехъядерный Android 7,0 Google Play WiFi Bluetooth дешевый и простой любимый подарок для детей планшетный ПК","4 158,76",,,BDF BDF Tablet Global Store Store
2464,"Lenovo XiaoXin Pad K11 Pro планшет, экран 11 дюймов, 6 ГБ + 750 Гб","27 067,68",,,Egoo Store
2465,"Планшет на Android 128, экран 10 дюймов, 8 + 10,0 ГБ, 4G LTE","9 282,25",,,RainBoo Store
2466,"2022 смартфон, Android 11,0, 8 Гб ОЗУ 128 Гб ПЗУ, 10,1 дюйма, 4k HD экран, Snapdragon 845, планшетный ПК, телефон с двумя SIM-картами или Wi-Fi","11 622,95",,,WLWY Store
2467,"Планшет на Android 2022, 9,0 дюйма, 8 + 10,1 ГБ, 10 ядер, 4G, Netcom","6 137,26",,,well tablet Store
2468,"Планшет с 10,1-дюймовым дисплеем, восьмиядерным процессором, ОЗУ 6 ГБ, ПЗУ 2022 ГБ, 4G, 2-мя слотами для SIM-карт","6 189,80",,,delicate tablet store Store
2469,"Планшет Lenovo YOGA TAB 5 X705F, Wi-Fi /X705M LTE, Восьмиядерный процессор Qualcomm 439, 4 Гб ОЗУ, 64 Гб ПЗУ, экран 10,1 дюйма 1920x1200 IPS, аккумулятор 7000 мАч, android","16 953,82",,,Egoo Store
2470,"Новый планшетный ПК Android 2022 Восьмиядерный Google Play Планшеты 8 ГБ ОЗУ 10,0 Гб ПЗУ GPS 10-дюймовый планшет стальной экран 4G телефон 128","6 126,75",,,100% tablet Store
2471,"Планшет с 10,1-дюймовым дисплеем, десятиядерным процессором, ОЗУ 4 Гб, ПЗУ 11,6 ГБ, 128x1920, 3G/4G LTE, GPS, Wi-Fi, 1080 мАч","10 902,04",,1,BDF BDF Tablet Global Store Store
2472,"Планшетный ПК с клавиатурой 3E Windows 10, 10,1 дюйма, с аккумулятором 8400 мАч, четырехъядерным процессором, 2 Гб ОЗУ, 64 Гб ПЗУ, 1366 * 768IPS, пылезащитный/во...","9 337,60",,,"Galavey Electronics Co, Ltd"
2473,"Планшет на Android 128, десять ядер, экран 10,1 дюйма, 6 ГБ + 1920 ГБ","20 175,88",,,honyuda Store
2474,"BDF 2022 новейший планшетный ПК 10 дюймов Android 9,0 планшет Восьмиядерный 3G Телефонный звонок 4 ГБ/64 Гб WiFi Bluetooth Google Play Pro планшет 10,1","5 646,84","5,0",1,BDF BDF Tablet Global Store Store
2475,"Планшетный ПК 2 в 1, 6 ГБ + 128 Гб, Face ID, 4G LTE, 10,5 дюйма, ноутбук-планшет 1920*1200, Android-планшет с клавиатурой, две SIM-карты, 13 МП","11 739,95",,,OneTablet Store
2476,"Lenovo Tab4 планшет с 10,1-дюймовым дисплеем, четырёхъядерным процессором, ОЗУ 2 Гб, ПЗУ 16 Гб, 10,1 мАч, 4G LTE","11 263,55","5,0",3,eForChina Store Store
2477,"Новинка 2022, планшет Android 10,0, 10,1 дюйма, 6 ГБ + 128 Гб, планшет, полный нетком, игровой Тонкий Планшет «Два в одном» для офиса, онлайн-класса","5 716,90",,,100% tablet Store
2478,"Планшет G12 Windows 10, 11,6*1366, IPS, Wi-Fi, 768 мАч, две камеры","8 856,99","4,8",21,Tablet inventory Store
2479,"Планшет Android 9,0, восемь ядер, 4 Гб + 64 ГБ","6 011,15",,,CN GO GO Jiuliuyar Store
2480,"Планшет HUAWEI MatePad T10 WiFi 2+32ГБ, 9.7 дюйма, Kirin 710A,【EAC, Доставка от 2 дней, Официальная гарантия】","13 491,00","4,4",18,Smart Life
2481,"Планшет Pro на Android 11,0, 16 ГБ ОЗУ 1 ТБ ПЗУ, 11 дюймов, 11666 мАч","18 631,06",,,Shop1100053025 Store
2482,"Горячая Распродажа Новый планшетный ПК 10 дюймов Android 9,0 планшет Deca Core Google Play 4g LTE телефонный звонок GPS WiFi Bluetooth закаленное стекло 10,1 дюйма","9 808,40",,,Peakier tablets Store
2483,"Планшет Lenovo Tab M10 TB-X605F, 2 + 16 ГБ, экран TB-X605M дюйма, Восьмиядерный процессор Qualcomm Snapdragon 10,1, Wi-Fi 8,0, 4G LTE, Android 450","9 737,64","4,2",10,Tablet PC Mall
2484,"Глобальная прошивка Lenovo YOGA Tab 5 YT-X705F 10,1-дюймовые планшеты ПК 4 ГБ 64 ГБ Android 9 Pie Qualcomm Snapdragon 439 Octa-core GPS 8MP","17 262,08","5,0",37,Tablet PC Mall
2485,"Blackview Tab 12 планшет, экран 10,1 дюймов, Android 11, 4G, 4 Гб ОЗУ 64 Гб ПЗУ","13 310,70",,,BLACKVIEW Authorized Store
2486,"2-в-1 планшетный ПК с док-клавиатурой 2 Гб DDR + 64 ГБ 10,1 дюйма Windows 10 четырехъядерный HDMI-совместимый Двойная камера WIFI","9 543,57","5,0",6,Shen Zhen Technology Wholesale Store
2487,"Планшет с 10,1-дюймовым дисплеем, десятиядерным процессором, ОЗУ 6 ГБ, ПЗУ 10,1 ГБ, 128x2,4","9 685,80",,,Tablet Factory Store
2488,"Глобальная версия, 10-дюймовый планшетный ПК 4G Pad 10s, IPS дисплей, Android 10,0, 8 ГБ + 128 ГБ памяти, Android","9 785,28","5,0",2,BEESITTO Official Store
2489,"2022 новый 10,1 дюймовый планшетный компьютер Android 10,0 6G память 128 Гб Память мужской планшет компьютер планшет с сенсорным экраном для детей","6 126,75",,,100% tablet Store
2490,"Blackview Tab 10 Pro смартфон с 10,1-дюймовым дисплеем, восьмиядерным процессором, ОЗУ 8 Гб, ПЗУ 10,1 ГБ, 2-мя слотами для SIM-карт","14 291,54",,4,Xphone Store
2491,"Планшет M40 Pro, 10 дюймов, Android, 8 ГБ ОЗУ, 128 Гб ПЗУ","9 975,84",,,WLWY Store
2492,"Планшетный ПК KIVBWY, 10,1-дюймовый планшет Android 10,1, Восьмиядерный Google Play, 4G LTE, телефонные звонки, GPS, Wi-Fi, Bluetooth, 10-дюймовая стеклянная панель","6 419,60","4,7",54,KIVBWY Store
2493,"Планшет с 10,1-дюймовым дисплеем, восьмиядерным процессором, ОЗУ 8 Гб, ПЗУ 2022 ГБ, 4G, 2-мя слотами для SIM-карт","6 200,31",,,Fashion tablet Store
2494,"ALLDOCUBE iPlay 40H 10,1-дюймовый планшет с восьмиядерным процессором Unisoc Tiger T618, ОЗУ 8 Гб, ПЗУ 10,4 ГБ, Android 11, 128x2000,4G LTE","14 711,90","5,0",1,ALLDOCUBE Global Official Store
2495,"Лидер продаж, планшетный ПК типа C, 10,1 дюйма, 2 Гб DDR + 32 ГБ, Windows 10, W8100, с контактной док-клавиатурой, двойной камерой, 32-бит, Wi-Fi","8 676,23","5,0",3,Shen Zhen Technology Wholesale Store
2496,"Дополнительная оплата (пожалуйста, не заказывайте, если мы не скажем вам)","2 101,80","4,1",29,SZ BDF TabletS Store
2497,"Планшет Xiaomi Mi Pad 5 Pro, 128 Гб/256 ГБ, 870 мАч","37 061,74",,1,3C-Tablet Online Store
2498,"Планшет Pro на Android 10, 12 Гб + 256 ГБ","8 757,50",,,jaysong tablets global Store
2499,"Планшет Pro Android 10 с динамиком и двойным вызовом, 12 Гб ОЗУ, 256 Гб ПЗУ, смартфон Google Play, бесплатная доставка, Wi-Fi","11 069,48",,,jaysong tablets global Store
2500,"Планшет с 11 дюймовым дисплеем, ОЗУ 128 ГБ, ПЗУ 512 ГБ, Android 10,0","12 050,32",,,jaysong tablets global Store
2501,"Смартфон Snapdragon 845, экран HD 512 дюйма, 12 Гб ОЗУ + 10,1 Гб ПЗУ, Android 11, 4G5G Wifi","10 999,42",,,LSKDZ Tablet Online Store
2502,"Новый планшет 2022 года, 12 Гб ПЗУ, 256 ГБ ОЗУ, устройство для обучения студентам, два в одном, полный ультратонкий экран Netcom, три камеры, GPS, Google Play","8 267,08",,,jaysong tablets global Store
2503,"Teclast T40 Pro планшет, экран 10,4 дюймов, 8 Гб ОЗУ 128 Гб ПЗУ, Android 11","13 703,74",,2,Teclast Global Direct Store
2504,"10,1-дюймовый планшет с восьмиядерным процессором, ОЗУ 2 Гб, ПЗУ 32 ГБ, Android 10,1","8 378,48",,,Smart-Life Store
2505,"10,1-дюймовый планшет с четырёхъядерным процессором, ОЗУ 1 ГБ, ПЗУ 32 ГБ, Android 10,1","5 835,30","5,0",13,Tablet inventory Store
2506,"Планшет Xiaomi Mi Pad 5 Pro, 11 дюймов, Snapdragon 870, 2,5 K, ЖК-дисплей, 120 Гц, 8 ГБ ОЗУ, 256 Гб ПЗУ, 8600 мАч, WIFI6, телефон со слотом для SIM-карты MIUI13","50 595,93","4,5",37,Xiaomi Pad Direct Store
2507,"Новый 7-дюймовый планшет с Wi-Fi, Android 7,0, четырехъядерный процессор, 2 ГБ + 16 ГБ, Bluetooth, Wi-Fi, магазин Google, дешевые и простые 7-дюймовые Планшеты Android","3 619,30","4,6",6,SHENZHEN BDF Tablet Store
2508,"Новинка 2022, планшетный ПК P60, 10 дюймов, Android 10,0, Восьмиядерный телефон, wi-fi, GPS, 8 ГБ + 128 ГБ, 13 + 5 Мп, двойная камера, 8000 мАч, x, 0 IPS","11 259,34","5,0",,Tablet Factory Store
2509,"8-дюймовый планшет с восьмиядерным процессором, ОЗУ 4 Гб, ПЗУ 64 ГБ, 9,0 мАч","6 312,41","5,0",1,CN GO GO Jiuliuyar Store
2510,"Оригинальный Jumper EZpad Pro 8 Tablet PC 11,6 дюймов 8 ГБ / 12 ГБ + 128 ГБ Windows 10 11 Intel N3350 Dual Core 1920x1080 9000 мАч Планшеты","26 959,09","5,0",2,Tablet PC Mall
2511,"10,1-дюймовый планшет с восьмиядерным процессором, ОЗУ 4 Гб, ПЗУ 64 ГБ, Android 10,1","6 613,66","3,7",4,CN GO GO Jiuliuyar Store
2512,Планшет HUAWEI MatePad Pro LTE 128Gb Серый,"39 990,00",,,TechWorld Store Store
2513,"Планшет Lenovo Tab P11 или Xiaoxin Pad, 11 дюймов, Wi-Fi, Восьмиядерный процессор Snapdragon 662, ОЗУ 6 ГБ, ПЗУ 128 ГБ, Android 10","14 126,90","4,9",7,VSTAR TECHNOLOGY INDUSTRY CO LTD
2514,"Планшет 2.5D на Android 2022, экран 10,1 дюйма, 8 ГБ + 10,0 ГБ","6 053,18",,,well tablet Store
2515,2021 промышленный ПК Android автобусная Автомобильная консоль автопилота жесткий планшет 7 дюймов читаемый солнечным светом GPS USB 4G LTE OBD HOS ОЗУ Кре...,"34 667,09",,,KT Technology
2516,"2-в-1 планшет, экран 10,1 дюйма, IPS 1920*1200, 8 ГБ ОЗУ 128 Гб ПЗУ, Bluetooth WiFi Android 10,0","10 158,00",,,Beesitto Online Store
2517,"Планшет Pro 10 дюймов, 4 ГБ/64 ГБ, Восьмиядерный процессор, две SIM-карты, функция телефонного звонка, WiFi, Bluetooth, GPS, Hipad, Android 9,0, планшет 10,1","6 748,88",,,ShenZhen BDF Tablet Technology Co. Store
2518,"Планшет Andoid9.0 на Android, восемь ядер, экран 10,1 дюйма, 4 Гб + 64 ГБ","5 983,12",,,BDF Official Store
2519,"Планшет G8811, 10,1 дюйма, Windows 10, 2 + 32 ГБ, HDMI, 8350x1280 IPS","7 895,76",,2,"Galavey Electronics Co, Ltd"
2520,"Планшет Android, 8 Гб ОЗУ 128 Гб ПЗУ, 10,1 дюйма, 4k HD экран","11 601,94",,,LSKDZ Tablet PC Store
2521,"Планшет с 10,1-дюймовым дисплеем, ОЗУ 8 Гб, ПЗУ 2022 ГБ, Android 10,1","6 095,22",,,Fashion tablet Store
2522,"Jumper Ezpad GO мини планшет, экран 8,9 дюймов, 4 Гб 64 ГБ, Windows 11, Intel Apollo Lake N3350","13 282,68","5,0",4,Tablet PC Mall
2523,"Дешевый Детский обучающий Подарочный планшет 7 дюймов HD IPS экран 16 ГБ Android 7,0 планшетный ПК для детей четырехъядерный планшет","11 360,23","5,0",,BDF BDF Tablet Global Store Store
2524,"Планшет с 10,1-дюймовым дисплеем, ОЗУ 12 Гб, ПЗУ 10,1 ГБ, android 11","10 999,42",,,LSKDZ Tablet Online Store
2525,"Blackview планшет с 10,1-дюймовым дисплеем, восьмиядерным процессором Spreadtrum SC9863A, ОЗУ 4 Гб, ПЗУ 64 ГБ, 10,1 мАч, 4G LTE","9 807,70","5,0",2,Creativehome
2526,"Планшет на Android 10,1, восемь ядер, экран 10,0 дюйма, 4 Гб + 64 ГБ","7 841,82","5,0",2,"SHENZHEN BDF TOUCH TECHNOLOGY CO.,LTD."
2527,"Планшетный ПК, 2022 дюйма, 6 ГБ + 10,1 ГБ, 4G, Wi-Fi","6 126,75",,,well tablet Store
2528,"Планшет с 10,1-дюймовым дисплеем, десятиядерным процессором, ОЗУ 4 Гб, ПЗУ 64 ГБ, 10,35x1332, 4G LTE, Bluetooth, Wi-Fi, GPS","7 814,49",,,ShenZhen Consumer E- Tech Store
2529,"Новая модель планшета 10,1 дюймов планшет Android 10,0 6 Гб RAM 64 Гб ROM 4G LTE 5G WiFi Bluetooth GPS 6000 мАч аккумулятор Type C планшеты ПК","8 528,40",,1,OneTablet Store
2530,"Планшет Lenovo Tab P11 Xiaoxin Pad, 11 дюймов, 6 + 128 ГБ, Wi-Fi","18 352,22",,,Samsung1 Earphone Authentication Store
2531,"Дешевый студенческий планшет Windows 10 Home 10,1 дюйма с клавиатурой ноутбук 2 Гб + 64 ГБ Intel Z3745D 1366x76 8 IPS Двойная камера HDMI","9 970,24",,1,XDrone Tablet Store
2532,"Планшет с 10,1-дюймовым дисплеем, ОЗУ 8 Гб, ПЗУ 10,1 ГБ, Android 11","11 597,73",,,LSKDZ Tablet PC Store
2533,"Высококачественный планшетный ПК HUAWEI MatePad Pro 12,6 дюймов 2560x1600 HarmonyOS 13MP камера Harman клавиатура M-pencil аккумулятор 10050mAh 5G","164 290,70","5,0",3,HUWEI Factory Store
2534,"Планшет детский, 2022 дюйма, 8 + 10,1 ГБ, Wi-Fi, зум","6 053,18",,,well tablet Store
2535,"7-дюймовый детский планшет Dragon Touch Y88X Plus, 16 ГБ, четырёхъядерный, Android 8,1","4 903,50",,2,DragonTouch Official Store
2536,"Планшет 2,4G + 5G, 10,1 дюйма, android 10,0, 8000 мА · ч, 10-ядерный планшет, 4G Lte, 6 ГБ ОЗУ, 128 Гб ПЗУ, планшеты 5 Мп + 13 МП","11 769,38",,,Baby Doing Buy Store
2537,"Новинка, Лидер продаж, 10,1-дюймовый планшетный ПК на базе Android 10,1, 8 ГБ ОЗУ + 9,0 Гб ПЗУ, аккумулятор 128 мАч, телефон, планшет","6 095,22",,,100% tablet Store
2538,"Планшет Mi Pad на Android 10, экран 10,1 дюйма, 4 Гб + 64 ГБ","6 460,23",,,ShenZhen Consumer E- Tech Store
2539,"Lenovo Xiaoxin Pad pro смартфон с 5,5-дюймовым дисплеем, процессором Snapdragon 12,6, ОЗУ 8 ГБ, ПЗУ 870 ГБ, 256x12,6, 2560 мАч","49 741,90","5,0",,E-live Store
2540,"BDF планшет с 8-дюймовым дисплеем, четырёхъядерным процессором, ОЗУ 4 Гб, ПЗУ 32 ГБ, Android 7,0, 2-мя слотами для SIM-карт","5 740,72","5,0",2,"SHENZHEN BDF TOUCH TECHNOLOGY CO.,LTD."
2541,"Планшет с 10,1-дюймовым дисплеем, четырёхъядерным процессором MTK 10,1, ОЗУ 1 ГБ, ПЗУ 16 ГБ, 6735 мАч, 2-мя слотами для SIM-карт","3 912,85","4,4",15,Tablet inventory Store
2542,"Планшет Lenovo YOGA TAB 5 YT X705F, Восьмиядерный процессор Snapdragon 439, 4 Гб ОЗУ, 64 Гб ПЗУ, экран 10,1 дюйма 1920x1200 IPS, 7000 мАч, Android 9","24 240,06",,,E-live Store
2543,"Планшет MX107, 10 дюймов, Android 10,0, 6 ГБ ОЗУ 64 Гб ПЗУ, 4G LTE","9 773,37",,,Professional Laptop Tablet Store
2544,"Новинка 10,1 дюймовый планшет Android 10,0 8 ГБ ОЗУ 128 Гб ПЗУ планшеты десятиядерный Google Play 1280x800 Двойная SIM-карта телефон планшетный ПК","6 200,31",,,well tablet Store
2545,"Новейший планшет Android 10,0, двойная 4G LTE 6 ГБ ОЗУ 128 Гб ПЗУ, Восьмиядерный процессор, двойная камера, Bluetooth, Wi-Fi, GPS, 10 параметров","8 473,76",,,BEESITTO Official Store
2546,"Планшет на Android 2022, экран 10,0 дюйма, 8 ГБ + 10,1 ГБ","6 095,22",,,Gifts Tablet Pc Store
2547,"Планшет HUAWEI MatePad 11 6 ГБ+ 64 ГБ | 2K экран | Частота обновления 120 Гц【Ростест, Доставка от 2 дней, Официальная гарантия】","30 490,00","4,8",176,Huawei Russian Official Store
2548,Планшет HUAWEI MatePad 11 10.95''| 6+128ГБ | Wi-Fi | 2560х1600 | Qualcomm® Snapdragon™ 865 | Частота обновления 120 Гц | Серый,"37 990,00","4,5",34,Huawei Russian Official Store
2549,"Новый игровой планшет LEGION Y700, 8G, 2022 ГБ, Восьмиядерный процессор Snapdragon 128, аккумулятор 870 мАч, зарядное устройство 50 Вт, 6550 дюйма, 8,8 Гц, камера 13 ...","36 487,25",,,Xiao-Mi- Store
2550,"10,1 планшет с экраном HD 4K, встроенная память 8 ГБ, встроенная память 128 ГБ, Android 11,0, Snapdragon 845, телефон с двумя SIM-картами или Wi-Fi","11 622,95",,,WLWY Store
2551,"Планшет на Android 10,1, восемь ядер, экран 9,0 дюйма, 4 Гб + 64 ГБ","6 624,17","5,0",1,BDF BDF Tablet Global Store Store
2552,"Фаблет с экраном 10,3 дюйма, Android 11,0, 4G, LTE, Sim-карта, металлический корпус, 6 ГБ ОЗУ, 128 Гб ПЗУ, Wi-Fi, Bluetooth","12 565,96",,,XDrone Tablet Store
2553,"Планшет с 7-дюймовым дисплеем, четырёхъядерным процессором, ОЗУ 2 Гб, ПЗУ 4 Гб, Android 6,0","3 661,34",,5,CN GO GO Jiuliuyar Store
2554,"Планшет HUAWEI MediaPad C3 на Android 8,0, экран 10,0 дюйма, 3 Гб + 32 ГБ","12 329,86",,,RFY-HUAWEI Online Store
2555,"Дешевый телефон, сканер отпечатков пальцев, 7 дюймов, MTK6737, 2 Гб ОЗУ, 32 Гб ПЗУ, 4G, GPS, 8500 мАч, NFC, LF, HF, UHF, RFID, автомобильный","15 399,19","5,0",1,XDrone Tablet Store
2556,"NX16A планшет с 10,1-дюймовым дисплеем, четырёхъядерным процессором, ОЗУ 1/2 ГБ, ПЗУ 32 ГБ, 10,1x1280, 5000 мАч","6 797,22","3,0",7,"Galavey Electronics Co, Ltd"
2557,"Планшет Xiaomi Mi Pad 5 с глобальной прошивкой, Wi-Fi, Google play, Snapdragon 860, 256 ГБ/128 ГБ, 120 Гц, 11-дюймовый ЖК-дисплей WQHD + 2,5 K, 8720 мАч","23 400,04","4,7",54,70mai-Goldway Store
2558,"Планшет с 10,1-дюймовым дисплеем, 10-ядерным процессором, ОЗУ 8 Гб, ПЗУ 2022 ГБ, Android 128, Wifi GPS","8 967,68",,,jaysong tablets global Store
2559,"Планшет New Tab 10, Android, 12 Гб ОЗУ, 512 Гб ПЗУ","10 859,30",,,jaysong tablets global Store
2560,"11 дюймовый планшет Pro, динамик, телефон, Pad Pro, Google Play, 12GBRAM 512 Гб ПЗУ, Android 10,0, двойной вызов, GPS, Bluetooth,12 ядер","8 267,08",,,jaysong tablets global Store
2561,"Двойной динамик, SIM-карта, Мобильный планшет Android 10,0, Google Store, Bluetooth, Wi-Fi, ОЗУ 16 ГБ + ТБ, сеть 4g","8 757,50",,,jaysong tablets global Store
2562,"Новый разблокированный планшетный ПК 2022 дюйма 10 ядер Android 10,1 4G планшет 6 ГБ ОЗУ 9,0 Гб ПЗУ планшет с двумя Sim-картами 128","6 198,91","5,0",1,well tablet Store
2563,"Оригинальный Планшет Lenovo XiaoXin Pad, Wi-Fi, 11 дюймов, ОЗУ 4 Гб ПЗУ 64 ГБ, распознавание лица, Qualcomm Snapdragon 662, Восьмиядерный процессор, 13 МП + 8 МП","12 399,92","5,0",5,aForChina Store
